{
  "$schema": "https://json-schema.org/draft/2020-12/schema",
  "$id": "https://raw.githubusercontent.com/NecturaLabs/app-updates/main/schema/update-manifest.schema.json",
  "title": "NecturaLabs app update manifest",
  "type": "object",
  "required": ["version"],
  "properties": {
    "version": {
      "type": "string",
      "description": "A build number (git rev-list --count of the build's commit on main, 1 to 9 digits, no leading zero), or the semantic version of a release made before builds were numbered. Builds are ordered by their number; a semantic version is older than every build.",
      "pattern": "^([1-9][0-9]{0,8}|(0|[1-9][0-9]*)\\.(0|[1-9][0-9]*)\\.(0|[1-9][0-9]*)(-[0-9A-Za-z.-]+)?(\\+[0-9A-Za-z.-]+)?)$"
    },
    "notes": { "type": "string" },
    "pub_date": { "type": "string", "format": "date-time" },
    "release_page": { "type": "string", "format": "uri" },
    "platforms": {
      "type": "object",
      "propertyNames": { "pattern": "^[a-z0-9_]+-[a-z0-9_]+$" },
      "additionalProperties": {
        "type": "object",
        "required": ["url"],
        "properties": {
          "url": { "type": "string", "format": "uri" },
          "sha256": { "type": "string", "pattern": "^[0-9a-f]{64}$" }
        },
        "additionalProperties": false
      }
    }
  },
  "additionalProperties": false
}
