{
  "version": "1279",
  "notes": "### Added\n\n- Ask before amending a commit that is already pushed.\n- State the outcome first in the repository hosting block.\n- Fetch the request list one page at a time.\n- Load more requests on demand.\n- Read the signed-in gh or glab token.\n- Use the signed-in gh or glab for pull and merge requests.\n- Search history for changed text with the pickaxe.\n- Search the history for changed text.\n- Search requests on the host.\n- Search and filter requests that are not loaded.\n- Quieter text fields and separate commit subject and body.\n- Pin the commit box and quiet the Changes page.\n- Load the next page when the list scrolls to its end.\n\n### Fixed\n\n- Select the row a context menu acts on when right-clicking.\n- Read again when the kernel interrupts a wait for a response.\n- Write the hosting status as plural sentences.\n- End the wait only on the page that was asked for.\n- Keep repository diff programs and the searched text out of history search.\n- Keep the token out of the Debug output of a resolved credential.\n- Read the CLI sign-in per account and bound its output.\n- Say which source an account's token comes from.\n- Keep the date whole in change search results.\n- Scroll a link Tab reaches into view in the reader.\n- Stop asking for a token when the host is unreachable.\n- Cut redundant markers and copy from the settings pages.\n- Show the recommended value of every setting.\n- Hide unprefixed tokens, passwords and emails.\n- Find an address's start on a character boundary.\n- Name settings by label and explain every row.\n- Label conflict sides by branch and use Accept wording.\n- Size selects and fields to their content.\n- Let zoom and quit work while a dialog is open.\n- Read again when a crash report's reply is interrupted.\n- Keep the dialog open when git refuses a worktree.\n- Write dates in the calendar format chosen in Settings.\n- Ignore common words when searching settings.\n- Stop warning when a git setting is simply unset.\n- Keep every subtitle on one line and drop config paths.\n- Show a row's notes as a mark beside its title.\n- Offer a repository only the choices git leaves to it.\n- List the recommended choice first in every select.\n- Write the consent dates the way the documents do.\n- Say why Pull requests is unavailable.\n- Say plainly what the welcome dialog promises.",
  "pub_date": "2026-10-13T00:44:05Z",
  "release_page": "https://github.com/NecturaLabs/app-updates/releases/tag/canopy-build-1279",
  "platforms": {
    "linux-aarch64": {
      "url": "https://github.com/NecturaLabs/app-updates/releases/download/canopy-build-1279/canopy-build-1279-aarch64-unknown-linux-gnu.tar.gz",
      "sha256": "ae5cbb20cda63282a18445e4267701e5c42d456f29927593517fc02192df8ce0"
    },
    "windows-x86_64": {
      "url": "https://github.com/NecturaLabs/app-updates/releases/download/canopy-build-1279/canopy-build-1279-x86_64-pc-windows-msvc.zip",
      "sha256": "f525618a2b9e3c73996269f2ef93bf31cd4eeff018347449ae94969342c88880"
    },
    "linux-x86_64": {
      "url": "https://github.com/NecturaLabs/app-updates/releases/download/canopy-build-1279/canopy-build-1279-x86_64-unknown-linux-gnu.tar.gz",
      "sha256": "7db7c2b6905f7173ce9f2e24b265b8647fff174b32ea7605466127bd27947d02"
    }
  }
}
